<?xml version="1.0" encoding="UTF-8"?>
<!-- edited by Eric Hughes 1 July 2011 to make DDMS 3.1 compliant -->
<!-- edited with XMLSPY v5 rel. 4 U (http://www.xmlspy.com) by Paul Lunceford 1/21/2010 to make DDMS 3.0 compliant (FGM, INC.) -->
<!-- edited with XMLSPY v5 rel. 4 U (http://www.xmlspy.com) by Joseph Pantella (FGM, INC.) -->
<!--Sample XML file generated by XMLSPY v5 rel. 4 U (http://www.xmlspy.com)-->
<ddms:Resource xmlns:ddms="http://metadata.dod.mil/mdr/ns/DDMS/3.1/"
			xmlns:ICISM="urn:us:gov:ic:ism"
			xmlns:gml="http://www.opengis.net/gml/3.2"
			xmlns:xsi="http://www.w3.org/2001/XMLSchema-instance"
			xsi:schemaLocation="http://metadata.dod.mil/mdr/ns/DDMS/3.1/ ../schemas/3.1/DDMS/ddms.xsd"
			ICISM:resourceElement="true" ICISM:DESVersion="5" ICISM:createDate="2010-01-21" ICISM:classification="U" ICISM:ownerProducer="USA">
	<ddms:identifier ddms:qualifier="http://metadata.dod.mil/mdr/ns/MDR/0.1/MDR.owl#URI" ddms:value="http://www.whitehouse.gov/news/releases/2005/06/20050621.html"/>
	<ddms:title ICISM:classification="U" ICISM:ownerProducer="USA">President Welcomes Vietnamese Prime Minister to the White House</ddms:title>
	<ddms:description ICISM:classification="U" ICISM:ownerProducer="USA">First official visit of a Vietnamese Prime Minister to the United States.</ddms:description>
	<ddms:language ddms:qualifier="http://metadata.dod.mil/mdr/ns/ExtStd/iso_639-2b.owl#en" ddms:value="en"/>
	<ddms:dates ddms:posted="2005-06-21"/>
	<ddms:rights ddms:copyright="true" ddms:privacyAct="false" ddms:intellectualProperty="false"/>
	<ddms:creator ICISM:classification="U" ICISM:ownerProducer="USA">
		<ddms:Organization>
			<ddms:name>Office of the Press Secretary</ddms:name>
		</ddms:Organization>
	</ddms:creator>
	<ddms:publisher ICISM:classification="U" ICISM:ownerProducer="USA">
		<ddms:Organization>
			<ddms:name>www.whitehouse.gov</ddms:name>
		</ddms:Organization>
	</ddms:publisher>
	<ddms:format>
		<ddms:Media>
			<ddms:mimeType>text/html</ddms:mimeType>
			<ddms:extent ddms:qualifier="http://metadata.dod.mil/mdr/ns/UnitOfMeasure/0.1/ComputerStorage.owl#byte" ddms:value="39195"/>
			<ddms:medium>digital</ddms:medium>
		</ddms:Media>
	</ddms:format>
	<ddms:subjectCoverage>
		<ddms:Subject>
			<ddms:category ddms:qualifier="http://metadata.dod.mil/mdr/ns/TaxFG/0.75c/Core_Tax_0.75c.owl#Political_event " ddms:code="Political_Event" ddms:label="Political Event"/>
			<ddms:keyword ddms:value="President Bush"/>
			<ddms:keyword ddms:value="Prime Minister Khai"/>
		</ddms:Subject>
	</ddms:subjectCoverage>
	<ddms:temporalCoverage>
		<ddms:TimePeriod>
			<ddms:start>2004-05-17T10:01:00</ddms:start>
			<ddms:end>2004-05-17T10:11:00</ddms:end>
		</ddms:TimePeriod>
	</ddms:temporalCoverage>
	<ddms:geospatialCoverage>
		<ddms:GeospatialExtent>
			<!-- The geographic identifier specifies The White House in the region of the Mid-Atlantic States. -->
			<ddms:geographicIdentifier>
				<ddms:name>The White House</ddms:name>
				<ddms:region>Mid-Atlantic States</ddms:region>
			</ddms:geographicIdentifier>
			<!-- The postal address specifies the address of The White House. -->
			<ddms:postalAddress>
				<ddms:street>1600 Pennsylvania Avenue, NW</ddms:street>
				<ddms:city>Washington</ddms:city>
				<ddms:state>DC</ddms:state>
				<ddms:postalCode>20500</ddms:postalCode>
				<ddms:countryCode ddms:qualifier="ISO-3166" ddms:value="USA"/>
			</ddms:postalAddress>
		</ddms:GeospatialExtent>
	</ddms:geospatialCoverage>
	<ddms:security ICISM:classification="U" ICISM:ownerProducer="USA" ICISM:excludeFromRollup="true"/>
</ddms:Resource>
